{
  "schema_version": "0.1.0",
  "id": "assessment-a",
  "revision_id": "assessment-a-r1",
  "canonical_track": {
    "id": "track-a",
    "revision_id": "track-a-r1"
  },
  "target_area": {
    "id": "area-a",
    "revision_id": "area-a-r1"
  },
  "relation": "partial",
  "coverage_completeness": "complete",
  "coverage_uncertainties": [],
  "target_segment_refs": [
    {
      "id": "segment-a-0",
      "revision_id": "segment-a-0-r1"
    }
  ],
  "algorithm": {
    "name": "target-area-assessment",
    "version": "0.1.0"
  }
}
