{
  "schema_version": "0.1.0",
  "id": "partial-incomplete-gap-assessment",
  "revision_id": "partial-incomplete-gap-assessment-r1",
  "canonical_track": {
    "id": "partial-incomplete-gap-track",
    "revision_id": "partial-incomplete-gap-track-r1"
  },
  "target_area": {
    "id": "partial-incomplete-gap-area",
    "revision_id": "partial-incomplete-gap-area-r1"
  },
  "relation": "unknown",
  "coverage_completeness": "incomplete",
  "coverage_uncertainties": [
    {
      "affected_track_range": {
        "start": {
          "part_index": 1,
          "observation_index": 1,
          "fraction_to_next": 0
        },
        "end": {
          "part_index": 2,
          "observation_index": 0,
          "fraction_to_next": 0
        }
      },
      "relevance": "The unresolved continuity break may contain an additional TargetArea crossing.",
      "provenance": {
        "name": "fixture-gap-relevance",
        "version": "0.1.0"
      }
    }
  ],
  "target_segment_refs": [
    {
      "id": "partial-incomplete-gap-segment-0",
      "revision_id": "partial-incomplete-gap-segment-0-r1"
    }
  ],
  "algorithm": {
    "name": "fixture-assessment",
    "version": "0.1.0"
  }
}
