{
  "schema_version": "0.1.0",
  "id": "scenario-assessment",
  "revision_id": "scenario-assessment-r1",
  "canonical_track": {
    "id": "scenario-track",
    "revision_id": "scenario-track-r1"
  },
  "target_area": {
    "id": "scenario-area",
    "revision_id": "scenario-area-r1"
  },
  "relation": "unknown",
  "coverage_completeness": "incomplete",
  "coverage_uncertainties": [
    {
      "affected_track_range": {
        "start": {
          "part_index": 0,
          "observation_index": 1,
          "fraction_to_next": 0
        },
        "end": {
          "part_index": 1,
          "observation_index": 0,
          "fraction_to_next": 0
        }
      },
      "relevance": "The unobserved continuity break could contain additional target coverage or leave the target.",
      "provenance": {
        "name": "fixture-gap-review",
        "version": "0.1.0"
      }
    }
  ],
  "target_segment_refs": [
    {
      "id": "audit-segment-0",
      "revision_id": "r1"
    },
    {
      "id": "audit-segment-1",
      "revision_id": "r1"
    }
  ],
  "algorithm": {
    "name": "fixture-assessment",
    "version": "0.1.0"
  }
}
